{
  "$schema": "https://json-schema.org/draft/2020-12/schema",
  "$id": "https://example.com/intent.schema.json",
  "title": "Intent",
  "type": "object",
  "required": [
    "schemaVersion",
    "level",
    "productType",
    "primaryGoal",
    "audienceSophistication",
    "emotionalRegister",
    "stakes",
    "oneLineDescription"
  ],
  "properties": {
    "schemaVersion": { "const": "1" },
    "level": { "enum": ["project", "surface", "component"] },
    "productType": {
      "enum": [
        "marketing-site",
        "saas-app",
        "e-commerce",
        "content-editorial",
        "utility-tool",
        "game",
        "creative-tool",
        "community-social",
        "dashboard",
        "internal-tool"
      ]
    },
    "primaryGoal": {
      "enum": [
        "convert",
        "activate",
        "retain",
        "inform",
        "entertain",
        "enable-productivity",
        "build-trust",
        "facilitate-transaction"
      ]
    },
    "audienceSophistication": {
      "enum": ["general-public", "professionals", "experts", "power-users", "mixed"]
    },
    "emotionalRegister": {
      "type": "array",
      "minItems": 1,
      "items": {
        "enum": [
          "serious-trustworthy",
          "playful-fun",
          "premium-refined",
          "raw-honest",
          "warm-personal",
          "clinical-precise"
        ]
      }
    },
    "stakes": { "enum": ["low", "medium", "high"] },
    "oneLineDescription": { "type": "string", "minLength": 10 },
    "capturedAt": { "type": "string", "pattern": "^\\d{4}-\\d{2}-\\d{2}T\\d{2}:\\d{2}:\\d{2}Z$" }
  },
  "additionalProperties": false
}
